title,date,sentiment_class
Michael Burry // 1.6 Billion Bet,2023-08-18,Neutral
Feeling a little uneasy these days…,2023-08-18,Uncertain
The AI hype cycle faces its first setback as summer doldrums drag on some of this year's biggest winners,2023-08-18,Bearish
Looking for Any IRL stories of staying invested.,2023-08-18,Neutral
Diversity with ETF’s,2023-08-18,Neutral
For the older traders (15+ years ago) what was trading like?,2023-08-18,Neutral
How bad is the bankruptcy from Evergrande for the stockmarket?,2023-08-18,Uncertain
Is Qualcomm a good buying opportunity or are their best days behind them ?,2023-08-18,Uncertain
"r/Stocks Daily Discussion & Fundamentals Friday Aug 18, 2023",2023-08-18,Neutral
"Car parts, solar panes and battery could get banned under US law on Chinese forced labor",2023-08-17,Uncertain
How to spinoffs typically affect stocks? Any clue what happens to my GM stock if Cruise LLC does spinoff and go public?,2023-08-17,Uncertain
Which stocks were predicted to be the next FAANGs and are now biting the dust?,2023-08-17,Uncertain
European stock to buy,2023-08-17,Neutral
"In general, where do you get your latest news from? Especially when it comes to smaller penny stock companies.",2023-08-17,Neutral
China’s Evergrande files for Chapter 15 bankruptcy,2023-08-17,Neutral
Unique assets fund for my retirement,2023-08-17,Neutral
Advice on PayPal,2023-08-17,Neutral
Are there inverse ETFs that are meant to be held overnight?,2023-08-17,Neutral
"Question regarding ""Wash Sales""",2023-08-17,Neutral
Hawaiian Electric Industries (what's your opinion?),2023-08-17,Neutral
CVS stock falls after Blue Shield of California drops pharmacy as benefit manager,2023-08-17,Bearish
"Adyen, cash or trash?",2023-08-17,Uncertain
"Adyen stock is down +33% today, what's happening?",2023-08-17,Bearish
"r/Stocks Daily Discussion & Options Trading Thursday - Aug 17, 2023",2023-08-17,Neutral
Energy Transfer to aquire Crestwood Equity,2023-08-17,Neutral
PCGU Delisted,2023-08-16,Uncertain
Thoughts on ICLN? Just hit a 52 week low today,2023-08-16,Bearish
QQQ 52w high down nearly 7%; who's been bear mode this whole time and how do you feel?,2023-08-16,Bearish
Are we headed for another 1970s style great inflation?,2023-08-16,Uncertain
The case for PagBank(NYSE:PAGS),2023-08-16,Neutral
JNJ/KVUE exchange offer odd lot opportunity,2023-08-16,Neutral
Fed projects skyrocketing nearly 6% GDP growth in third quarter.,2023-08-16,Bullish
Fed Saw ‘Significant’ Inflation Risk That May Merit More Hikes,2023-08-16,Stable
Are there any pure Natural Gas plays?,2023-08-16,Neutral
$INTC Intel's $5.4 billion acquisition of $TSEM Tower Semiconductor called off due to lack of Chinese regulatory approval,2023-08-16,Uncertain
Quantum computing is the future,2023-08-16,Neutral
Are Visa and Mastercard exposed to credit card defaults?,2023-08-16,Neutral
Why are tech stocks falling today?,2023-08-16,Uncertain
"Green market (environmentally friendly, not weed) for long term investing.",2023-08-16,Stable
Hai Di Lao (HKG:6862) DCF Analysis: China's Best Hotpot Chain.,2023-08-16,Neutral
Silly Stock Analysis: Can you make money by buying a stock on a given day of the week and selling it on a given day of the week,2023-08-16,Speculative
SoFi - Questionable Accounting and Business Model,2023-08-16,Uncertain
US stocks set for muted open as focus shifts to FOMC minutes: Why this analyst sees possible year-end rally after likely pause,2023-08-16,Neutral
"$COIN, $MARA, or $RIOT: Which mining stock scores “Strong Buy” Rating?",2023-08-16,Neutral
Why does Target jump +8% pre-market after it just slashed its full-year forecast?,2023-08-16,Uncertain
Tax when selling part of the stock,2023-08-16,Neutral
Question about Finance / Fintech,2023-08-16,Neutral
How you you play PANW earnings?,2023-08-16,Neutral
"r/Stocks Daily Discussion Wednesday - Aug 16, 2023",2023-08-16,Neutral
Why did Jinko Solar (JKS) go down even after beating eps and earnings expectations?,2023-08-16,Uncertain
Genuine question - Why sell?,2023-08-16,Neutral
Options trading,2023-08-15,Neutral
We Will Never See March 2020 Volatility Again!,2023-08-15,Stable
Difference between NASDAQ quotes on Investing dot com and on ForexTime,2023-08-15,Neutral
ASML - Fair value based on DCF,2023-08-15,Neutral
How do you think widespread adoption of driverless technology would affect infrastructure stocks?,2023-08-15,Neutral
Questrade is asking me to transfer my BBBQ from TSFA to a registered account since it was delisted months ago.,2023-08-15,Neutral
Activist investor Elliott Investment Management dissolves stake in PayPal,2023-08-15,Neutral
Do you believe in CHPT over 1-2 year period?,2023-08-15,Neutral
Lyft Price Action,2023-08-15,Stable
How can I take advantage of student loan payments restarting?,2023-08-15,Neutral
shorting NVDA,2023-08-15,Bearish
"Retail sales increased 0.7% in July, better than expected as consumer spending is holding up",2023-08-15,Stable
"Fitch warns it may be forced to downgrade dozens of banks, including JPMorgan Chase",2023-08-15,Uncertain
"r/Stocks Daily Discussion & Technicals Tuesday - Aug 15, 2023",2023-08-15,Neutral
"UAW Makes Ambitious Demand: 46% Rise in Pay Over 3 Years, Potentially $80B.",2023-08-15,Stable
"Japan GDP grew 6%, handily beating expectations on robust exports",2023-08-15,Bullish
Hawaiian Electric (HE) stock closes down almost 34% following class action lawsuit related to Maui wildfires,2023-08-15,Bearish
Few questions about future of robo taxis,2023-08-14,Neutral
What happens to stock when company get bough for cash? ATVI - MSFT Deal,2023-08-14,Neutral
'The Big Short' Michael Burry makes big bet against the market with 93% of portfolio in SPY and QQQ puts.,2023-08-14,Bearish
Saudi-funded Savvy Games was the mystery partner in collapsed $2B Embracer deal,2023-08-14,Neutral
Walmart DD ahead of earnings Thursday,2023-08-14,Neutral
Which evil/unethical companies you invest in?,2023-08-14,Neutral
"Standard & Poor's - With 89% of companies reporting, 2Q profits are lapping YOY at 15.9% with revenue Up 6.9% vs. 2022 2Q.",2023-08-14,Neutral
Please explain the Barstool and Penn deal,2023-08-14,Neutral
Intuit’s Alex Chriss named new PayPal CEO,2023-08-14,Neutral
Tesla Drops 3% After Price Cuts Announced in China,2023-08-14,Bearish
Thoughts on Canadian Solar (CSIQ),2023-08-14,Neutral
Trading ETFs on the News,2023-08-14,Neutral
Defense industry stocks which will benefit from the new Cold War,2023-08-14,Bullish
"r/Stocks Daily Discussion Monday - Aug 14, 2023",2023-08-14,Neutral
Can't get myself back on Amazon,2023-08-14,Neutral
Pfizer - a future outlook,2023-08-14,Neutral
would like to make a decent amount off dividends just to supplement my lifestyle. what are the safest options?,2023-08-14,Stable
"BRICS Countries Planning New Gold-Backed Currency [Jul 10, 2023]",2023-08-13,Stable
"PayPal CEO Replacement - Ex Tesla CFO, Zach Kirkhorn?",2023-08-13,Neutral
"Why I believe TJX, which reports earnings this week, is a good stock pick",2023-08-13,Bullish
US STEEL (NYSE:X) rejecting Cleveland-Cliffs (CLF) offer,2023-08-13,Neutral
Who can explain this better?,2023-08-13,Neutral
Is Fang still an option?,2023-08-13,Neutral
Google/Alphabet will release Gemini AI later this year. Probably way more powerful than GPT-4. Time to buy?,2023-08-13,Bullish
Former VP claims Salesforce lied about software capabilities: 'It was all a lie.',2023-08-13,Uncertain
Stock Score System Reliability,2023-08-13,Stable
Impairment - explained through examples,2023-08-13,Neutral
Is there a way to find lost stocks?,2023-08-13,Uncertain
What are some good cheap ETF’s to get for options trading?,2023-08-12,Neutral
"r/Stocks Weekly Thread on Meme Stocks Saturday - Aug 12, 2023",2023-08-12,Neutral
How SCOTUS transformed sports betting into a high-growth tech business: Americans have bet $245B on sports since 2018,2023-08-12,Neutral
Need advice regarding footlocker earnings august 23rd,2023-08-12,Neutral
BYD stock - pro's and con's?,2023-08-12,Neutral
"Challenge my Thesis, ""Copper is the Opportunity of the Decade""",2023-08-12,Speculative
"/r/Stocks Weekend Discussion Saturday - Aug 12, 2023",2023-08-12,Neutral
IonQ's Quantum Leap: A Review of Q2 2023 Performance and Future Prospects,2023-08-12,Neutral
UNDER ARMOUR THE NEXT 5X?,2023-08-12,Speculative
"How do you guys interpret News, analysis, etc",2023-08-12,Neutral
"Tax loss harvesting, am I doing it correctly?",2023-08-11,Neutral
Advice Request with questions on stocks and broader stock market I thought belong here,2023-08-11,Neutral
Wells Fargo Class Action,2023-08-11,Uncertain
"Wall Street Week Ahead for the trading week beginning August 14th, 2023",2023-08-11,Neutral
Application of AI in the tech and medical industries:,2023-08-11,Neutral
Thoughts On Creating Your Own Portfolio,2023-08-11,Neutral
Stocks Feel the Heat as Oil Prices Surge,2023-08-11,Uncertain
"Canadian Oilsands Producers: SU, CNQ, CVE, etc.",2023-08-11,Neutral
Military Industrial Complex Investing - restocking winners?,2023-08-11,Speculative
Apple stock back to $200 by end of year?,2023-08-11,Speculative
I bought options for a company that got bought out... Did I make money or are they worthless?,2023-08-11,Uncertain
Fear & Greed Index Remains In 'Greed' Zone Following Inflation Data,2023-08-11,Neutral
"IBM, what's not to like?",2023-08-11,Neutral
Aritzia Inc. (ATZ.TO),2023-08-11,Neutral
"NVDA shares have tripled in 2023, while the Nasdaq-100 has climbed 38% and the S&P 500 has gained 16%",2023-08-11,Bullish
Bear Case for CROX?,2023-08-11,Bearish
"r/Stocks Daily Discussion & Fundamentals Friday Aug 11, 2023",2023-08-11,Neutral
Sportradar (SRAD) continues to impress under the radar (Q2 Earnings),2023-08-11,Bullish
Do you know a free & open source charting software?,2023-08-11,Neutral
"Waymo, Cruise win approval for 24/7 paid services in San Francisco",2023-08-10,Stable
Better performance than Google,2023-08-10,Bullish
Structural Shifts in the Global Economy - FED-Jackson Hole/BRICS,2023-08-10,Neutral
What's the difference between these two stocks for the same company,2023-08-10,Neutral
How does enterprise value make sense and how does it compare to a discounted cash flow?,2023-08-10,Neutral
Future of Disney,2023-08-10,Neutral
1 trillion in credit card debts is it a problem for the USA economy?,2023-08-10,Uncertain
"Sony Q1 revenue up 33% YoY to ~$20.7B, PS5 sales up 38% YoY to 3.3M, raises sales forecasts for the full year + more good news for Sony",2023-08-10,Bullish
AQN - Algonquin Power & Utilities Corp. Will Pursue Sale of Renewable Energy Group Following Strategic Review; Announces 2023 Q2 Results,2023-08-10,Neutral
What is the deal with WeWork? Did pandemic help or hurt it ?,2023-08-10,Uncertain
How to get invited to AGM's?,2023-08-10,Neutral
India clears Sony-Zee deal to form $10 bln entertainment powerhouse,2023-08-10,Neutral
"r/Stocks Daily Discussion & Options Trading Thursday - Aug 10, 2023",2023-08-10,Neutral
Help with reading Duolingo financials,2023-08-10,Neutral
How do you identify whether we're in a bull/bear market?,2023-08-10,Neutral
"Anheuser-Busch Slashes Craft Beer Portfolio, Selling 8 Brands to Tilray",2023-08-09,Stable
Insiders keep selling Apple stocks and no one buying this year. Thoughts?,2023-08-09,Bearish
Penn says that it expects to record a loss of between $800 million-$850 million on Barstool Sports. As Dave Portnoy buys it back for $1.,2023-08-09,Neutral
Smallish Canadian Oil Company Vermillion Energy (NYSE: VET) with a surprisingly solid outlook.,2023-08-09,Neutral
Paypal can buyback 19% of its entire company today,2023-08-09,Neutral
"Disney posts mixed results for quarter plagued by streaming woes, restructuring costs",2023-08-09,Neutral
Are we on the verge of another crash?,2023-08-09,Uncertain
Time for Roblox?,2023-08-09,Speculative
This sell off,2023-08-09,Bearish
I think EA needs to sell themselves because they can't figure out how to make their stock proce go up on their own,2023-08-09,Bearish
What would happen to CZR if they do successfully offload some properties?,2023-08-09,Neutral
"Here’s my portfolio, 13% return after ~1 year. What should I improve?",2023-08-09,Neutral
Do you know Comcast has puts on Hulu to make Disney pay at least $10billion they don't have?,2023-08-09,Neutral
Scaffolding companies play?,2023-08-09,Neutral
NVO - great moat?,2023-08-09,Speculative
PayPal is trying to drag its 435 million users into the $120 billion stablecoin market.,2023-08-09,Neutral
What do you think about NWN?,2023-08-09,Neutral
"r/Stocks Daily Discussion Wednesday - Aug 09, 2023",2023-08-09,Neutral
Is it a good idea to change my strategy? (Read Below),2023-08-09,Uncertain
Did any notable growth stocks have a good reaction post earnings?,2023-08-09,Neutral
What price do you get if you buy into a mutual fund on the ex-dividend date?,2023-08-09,Neutral
Confused regarding limit buy order,2023-08-08,Neutral
what does it mean when there's a 0 in a company's total revenue and operating revenue?,2023-08-08,Neutral
Called it... and AKAM should only be up from here,2023-08-08,Bullish
Any thoughts on NEE?,2023-08-08,Neutral
Buying stock with high p/e ratio,2023-08-08,Speculative
ITW raises dividend and increases buybacks,2023-08-08,Neutral
What’s your stock market investing strategies?,2023-08-08,Neutral
Why Doesn't USNZ Update Price Throughout the Day?,2023-08-08,Uncertain
IPO recap of the last few years. Seems like most are underwater.,2023-08-08,Bearish
Datadog's ($DDOG) Stock Plummets more than 20%: What Went Wrong?,2023-08-08,Bearish
"For those with great portfolio returns, or are beating the market, how many of your stock picks went bust?",2023-08-08,Neutral
Pension fund: 3% guaranteed over CPI or split 50/50 with SP500 over the next 15 years?,2023-08-08,Stable
When should you consider cutting losses even as a long term investor with large time horizon?,2023-08-08,Uncertain
Know The Company - Okta,2023-08-08,Neutral
Tracking down stocks on paper certificates from family,2023-08-08,Neutral
Eli Lilly raises full-year guidance as Mounjaro and other drugs drive second-quarter profit up 85%,2023-08-08,Bullish
"Apple, Nvidia, Intel, and Others Interested in Arm’s Upcoming Blockbuster IPO",2023-08-08,Neutral
Moody’s cuts ratings of 10 U.S. banks and puts some big names on downgrade watch,2023-08-08,Bearish
Today Upcoming Earning Calls of The Developer Tools Index - Akamai ($AKAM) and New Relic ($NEWR),2023-08-08,Neutral
Help Understanding YELL,2023-08-08,Neutral
(8/8) Tuesday's Pre-Market Stock Movers & News,2023-08-08,Neutral
LK-99 Superconductor and potential Stocks?,2023-08-08,Speculative
"r/Stocks Daily Discussion & Technicals Tuesday - Aug 08, 2023",2023-08-08,Neutral
UPST Yesterday?,2023-08-08,Neutral
$SOUN-Worth buying the dip?,2023-08-08,Speculative
FMC Outlook After Recent Drop,2023-08-08,Uncertain
What is a good strategy to follow when selling a stock while you are down?,2023-08-08,Neutral
Is the great inflation just starting?,2023-08-07,Uncertain
HIMS Q2 Results,2023-08-07,Neutral
Anyone Looking At $SARK,2023-08-07,Speculative
Have a fidelity account I don’t put money in but has some stocks….,2023-08-07,Neutral
"Growth opportunities in emergent markets. (Semiconductors, energy, etc.) Which sectors are at the top of your list and why?",2023-08-07,Neutral
Blackrock TCP Capital (TCPC),2023-08-07,Neutral
Roth IRA for daughter,2023-08-07,Neutral
Paramount his 61M subscriber,2023-08-07,Neutral
"Pltr earnings are in line with estimates, guidance raised",2023-08-07,Bullish
Looking for ways to short CMBS / Office Space,2023-08-07,Speculative
ENPH - What caused it to spike to $336 and what caused it to drop to now $136?,2023-08-07,Uncertain
Tyson Foods’ stock slides 6% after company swings to a quarterly loss,2023-08-07,Bearish
Tesla CFO Zach Kirkhorn steps down,2023-08-07,Neutral
Was there news about the government wanting to stop brokerages from charging consumers for trading (not the exact description)?,2023-08-07,Neutral
Is now a good time to invest into stock market?,2023-08-07,Neutral
Does anyone think AAPL is a buy now?,2023-08-07,Speculative
Is there ever a discrepancy between the S&P 500 and a portfolio of the same weighted companies?,2023-08-07,Neutral
Countries that are undervalued,2023-08-07,Neutral
"r/Stocks Daily Discussion Monday - Aug 07, 2023",2023-08-07,Neutral
Fundamental analysis options,2023-08-06,Neutral
Paypals New Ceo could be original Founder Max Levchin,2023-08-06,Neutral
"About Roth IRA Contributions, gains, taxes",2023-08-06,Neutral
Nvidia upcoming Earnings,2023-08-06,Speculative
Recall NIO 2020 SP Spike - Better Positioned Now => Will History Repeat,2023-08-06,Speculative
Fed’s Bowman says more U.S. rate hikes likely will be needed,2023-08-06,Neutral
Thoughts on future for solar and wind stocks (TAN and FAN specifically)?,2023-08-06,Neutral
HelloFresh stock analysis and valuation - One of my largest positions,2023-08-06,Neutral
Yahoo Finance Is Wrong?,2023-08-06,Neutral
"WSJ: Pfizer’s Covid Boost Crashes to Earth. ""Shares are down 31% YTD, a loss of more than $88 billion in market capitalization""",2023-08-06,Bearish
CEPU: A Good Investment Amidst Argentina's Electoral Dynamics,2023-08-06,Neutral
The most valuable stock on the US stock market in the next 40 years.,2023-08-06,Speculative
What happens to a short position when the company is acquired for cash?,2023-08-06,Neutral
Friday's stock market action,2023-08-06,Neutral
"Cactus Inc (WHD), a strong energy services name",2023-08-06,Neutral
What is the minimum Net Worth needed to invest in big VC funds like Sequioa Capital?,2023-08-05,Neutral
Why Berkshire always reports earnings on the weekend,2023-08-05,Stable
"Best, 0% b.s. sources for stock market",2023-08-05,Neutral
Warren Buffett Investments,2023-08-05,Neutral
Looking for Transfer Agent Assistance,2023-08-05,Neutral
Curious of what others are struggling with in the markets,2023-08-05,Neutral
"r/Stocks Weekly Thread on Meme Stocks Saturday - Aug 05, 2023",2023-08-05,Neutral
How much risk is in the Chinese Banking sector?,2023-08-05,Uncertain
Berkshire Operating Earnings Jump on Insurance Strength,2023-08-05,Stable
Are any of these generational buying opportunities?,2023-08-05,Speculative
Atlassian ($TEAM) Q4 FY23 - Stock Surges 24%,2023-08-05,Bullish
Where can I find a comprehensive list of all U.S. stock market tickers?,2023-08-05,Neutral
Deteriorating Household Finances Will Not Support Strong Spending,2023-08-05,Bearish
"/r/Stocks Weekend Discussion Saturday - Aug 05, 2023",2023-08-05,Neutral
What kind of app provides this type of scanner that gives live High/Low tickers?,2023-08-04,Neutral
Portfolio diversification,2023-08-04,Neutral
How do I incorporate lump sums into my dollar cost average strategy?,2023-08-04,Neutral
"Wall Street Week Ahead for the trading week beginning August 7th, 2023",2023-08-04,Stable
Why is no one talking about Amkor (AMKR) ?,2023-08-04,Neutral
How are stock brokers earning money on deposits and giving away 4% interest rates?,2023-08-04,Neutral
FactSet's Earnings Update with 84% of the the S&P 500 Companies Reporting (about 80% of market cap),2023-08-04,Neutral
Hedge funds lose $6bn betting against cruise lines and hotels stocks,2023-08-04,Bearish
WBD popping today 7.5%+,2023-08-04,Bullish
"Thoughts on New (June 2023) ""Tactical Enhanced"" US ETF",2023-08-04,Neutral
Meta Warrants,2023-08-04,Speculative
Tesla is facing a class action lawsuit after bombshell report on exaggerated driving range and “diversion team”,2023-08-04,Bearish
"The U.S. economy added 187,000 jobs in July, fewer than expected",2023-08-04,Neutral
Just found out about AOH1996,2023-08-04,Neutral
On Tesla's valuation (Part 5),2023-08-04,Neutral
"r/Stocks Daily Discussion & Fundamentals Friday Aug 04, 2023",2023-08-04,Neutral
How does overnight trading work? I don’t understand BUD’s movement before open yesterday.,2023-08-04,Neutral
How do analysts come up with such accurate earnings estimates?,2023-08-03,Neutral
UAW Demands 40% Pay Hike in Labor Talks With Detroit Automakers,2023-08-03,Stable
Oil and Gas E&P,2023-08-03,Stable
War in Africa FUD potentially involving 10+ countries and the Wagner group,2023-08-03,Uncertain
ENPH or Solar ETF?,2023-08-03,Neutral
"Stem Inc ($STEM) Q2 Earnings - Earnings Beat, EPS Miss, 2023 Guidance Reaffirmed!",2023-08-03,Neutral
What happens to CS Puts if Robinhood no longer supports a stock and the company is OTC? APPHQ,2023-08-03,Uncertain
Thoughts on Home Depot?,2023-08-03,Neutral
Is there a way to get the theoretical price of bond etfs given varying interest rates?,2023-08-03,Neutral
I don't know a lot about stocks but I want to know if this strategy can work,2023-08-03,Neutral
My Paypal updated thesis,2023-08-03,Neutral
"Apple Posts Q3 EPS of $1.26 on Revenue of $81.8 Billion, vs CIQ Analyst Consensus of $1.19/Share on Revenue of $81.8 Billion",2023-08-03,Bullish
Do share prices tend to shift a lot around large market events?,2023-08-03,Uncertain
Amazon reports sales growth of 11% and issues optimistic guidance,2023-08-03,Bullish
COCO - what happened yesterday after earnings?,2023-08-03,Uncertain
Gallium producers to invest in (that are not sanctioned in the US)?,2023-08-03,Neutral
Could Blackberry have competed with Apple if they didn't drop the ball so bad?,2023-08-03,Uncertain
Anyone else think Disney is a good buy?,2023-08-03,Speculative
Confluent ($CFLT) Q2 2023 Summary - Stock up by 15.12% today,2023-08-03,Bullish
Whats up withe TQQQ today,2023-08-03,Neutral
"WBD narrows streaming loss thanks to 3x higher content licensing revenue ($410M). More ""co-exclusive"" deals coming.",2023-08-03,Bullish
Long-term options: Lower strike vs later expiration,2023-08-03,Neutral
Starting Portfolio,2023-08-03,Neutral
PayPal is getting crushed,2023-08-03,Bearish
Between just these two companies which would be a better buy long term? SWK or TGT? Which would have a better chance at recovery?,2023-08-03,Neutral
Expedia Earnings Q2 2023 (Stock Down 14%),2023-08-03,Bearish
The founder of Apple's key supplier said the US stock market would collapse in '10 seconds' if war breaks out in Taiwan.,2023-08-03,Uncertain
(8/3) Thursday's Pre-Market Stock Movers & News,2023-08-03,Neutral
"Nintendo posts record profits. Operating profit up 82%, net profit up 50%. Software sales up 26%",2023-08-03,Bullish
"r/Stocks Daily Discussion & Options Trading Thursday - Aug 03, 2023",2023-08-03,Neutral
At What Rate Is it Better to Put Money in a CD Over the S&P500?,2023-08-03,Neutral
Should I sell stock to put it into my Roth?,2023-08-02,Neutral
Should I sell or keep my shares?,2023-08-02,Uncertain
What Do I Diversify Into? (small $ monthly investments),2023-08-02,Neutral
"JPMorgan CEO Jamie Dimon calls Fitch Ratings U.S. downgrade ‘ridiculous,’ but says ‘doesn’t really matter’",2023-08-02,Neutral
Bonds vs S&P 500?,2023-08-02,Neutral
Which stock do you see reaching the $1 Trillion Market Cap mark within 5 years?,2023-08-02,Speculative
How to find small cap ETFs do a small part of my portfolio. Obviously aggressive and risky but want to put a small percentage towards this,2023-08-02,Speculative
Owning vtsax and Vfifx unnecessary?,2023-08-02,Neutral
Where can you find summaries of the historical fundamentals for an index?,2023-08-02,Neutral
(8/2) Wednesday's Pre-Market Stock Movers & News,2023-08-02,Neutral
"r/Stocks Daily Discussion Wednesday - Aug 02, 2023",2023-08-02,Neutral
Coffeeshop Stocks,2023-08-02,Neutral
Is it worth it for a 17 year old to put money into the Dow Jones or S&P 500 ETF if I’m only putting an original investment of around $1500?,2023-08-02,Neutral
"Hawaii Electric says goal is ""not to restructure,"" stating shutting off power is not part of their high wind protocol.",2023-08-18,Stable
Bulls makes money bears make money only pigs get slaughtered. Guess which one am I?,2023-08-18,Neutral
Puts on Tesla sorry @Elon need this bread 🍞,2023-08-18,Neutral
Tilray now fully owns Truss drinks,2023-08-18,Neutral
AMAT will make you rich,2023-08-18,Speculative
Shouldn't this be a Wendy's?,2023-08-18,Neutral
I like charts. DJIA is at a point. Will it bounce off the bottom line of the trend or go though it and test new lows?,2023-08-18,Speculative
CAVA stock explanation?,2023-08-18,Neutral
Turkey’s Erdogan fires statistics chief after inflation data shows 19-year high,2023-08-18,Uncertain
Lucid stock falling,2023-08-18,Bearish
How is $NKLA $2?,2023-08-18,Neutral
Seeking Job Advice,2023-08-18,Neutral
u/cookies_and_beandip hope you’re hungry,2023-08-18,Neutral
What is causing the significant increase in Treasury yields and how does it impact you?,2023-08-18,Neutral
TSLA seems to have shifted into a growth deceleration phase for unit sales.,2023-08-18,Neutral
Looking for Car wash stocks,2023-08-18,Neutral
Inflation Data has Always Been a Lie,2023-08-18,Uncertain
"Not to fret my comrades, our fearless leader JPOw the boneless will soon open spigots of infinite money for banks.",2023-08-18,Speculative
What singular company or corporation would cause the worst worldwide financial disaster if the stock goes to 0?,2023-08-18,Uncertain
Full Port - 7.8k in SPY / QQQ Calls near open expiring throughout the next week,2023-08-18,Neutral
Market today,2023-08-18,Neutral
Diebold bond loss,2023-08-18,Bearish
RIP Evergrande,2023-08-18,Bearish
This recent sell off is expected,2023-08-18,Bearish
We got nothing better to do,2023-08-18,Neutral
Welp. Wat do?,2023-08-18,Uncertain
I did. It. I'm green,2023-08-18,Bullish
Where to even put money?,2023-08-18,Uncertain
So did Burry make bank?,2023-08-18,Neutral
Investment strategies and inflation in 2023,2023-08-18,Neutral
