title,date,sentiment_class
"The prophet has spoken, found on the ground at Water Street , FIDI",2023-08-18,Uncertain
Don’t trade options they said…,2023-08-18,Neutral
Quarterly Blowing Up Of My Portfolio ,2023-08-18,Speculative
APEs - AMC Preferred Conversion,2023-08-18,Neutral
How China's economic turmoil could hurt your portfolio,2023-08-18,Uncertain
Options Trading Training App,2023-08-18,Neutral
That 401k is looking more like a 200.5k,2023-08-18,Bearish
"Most Anticipated Earnings Releases for the week beginning August 21st, 2023",2023-08-18,Neutral
BTC volatility and why the KCGI trading contest could timely.,2023-08-18,Neutral
This is a normal correction. Here in the Hamptons champagne is still flowing,2023-08-18,Stable
😀🦫🌽 So we have been right the hole time,2023-08-18,Bullish
Where is the bottom in $SPX?,2023-08-18,Uncertain
"Daily Discussion Thread for August 18, 2023",2023-08-18,Neutral
Brace Yourselves: The Storm Clouds of Market Collapse Loom,2023-08-18,Bearish
Shorting the NASDAQ 100,2023-08-18,Bearish
"I bring good news for Bond Bulls in the short term. In the long term, 10yr yields are going way higher.",2023-08-18,Bullish
🌈 🐻 We’ve been right this whole time 💦💦,2023-08-18,Bullish
Bears and Self Destruction,2023-08-18,Bearish
Gain Porn: Fannie Mae (FNMA) +$29k single day gain - Holding to $5m+,2023-08-18,Bullish
Debt to Income ratio for homebuyers (DTI) hits all time high in 2023,2023-08-17,Neutral
do not dumb here not dumb area here,2023-08-17,Neutral
Spy FDs,2023-08-17,Neutral
Does the DIA run the USA ??,2023-08-17,Neutral
"Here me out, The signs for MODG being the next big thing are everywhere!",2023-08-17,Speculative
FWRD Stock - Speculation About Merger With Omni Air,2023-08-17,Speculative
VIX ready to fall?,2023-08-17,Speculative
Topgolf Callaway a hole-in-one?,2023-08-17,Neutral
Tsunami formation incoming,2023-08-17,Speculative
How do I get the regard clothes for my avatar? (Loss Porn),2023-08-17,Neutral
Never give up. I’m back in deep.,2023-08-17,Speculative
MSFT Next quarter guidance + revenue/eps growth,2023-08-17,Bullish
Evergrande has filed for bankruptcy..,2023-08-17,Bearish
China's Evergrande files for bankruptcy. Shorts gonna blow up.,2023-08-17,Bearish
Instacart Plans for September IPO in Boost for US Listings,2023-08-17,Neutral
Is this a sign for Friday earnings?,2023-08-17,Speculative
Deere earnings,2023-08-17,Neutral
🤡🤡🤡 the drop... It's priced in,2023-08-17,Bearish
$NVAX DD: To the Moon 🚀,2023-08-17,Bullish
Sell NVDA,2023-08-17,Bearish
Waiting for market open ...,2023-08-17,Neutral
u/Cookies_and_Beandip on notice,2023-08-17,Neutral
"Yes, Mortgage Rates Are Now The Highest in More Than 20 Years, But Not Much Higher Than Yesterday",2023-08-17,Stable
Wake Me Up When September Ends 🎶,2023-08-17,Neutral
I’ll see your option yolos and raise you futures.,2023-08-17,Speculative
China Evergrande files for chapter 15 bankruptcy in US - court filing,2023-08-17,Uncertain
China Evergrande Files Chapter 15 Bankruptcy in New York,2023-08-17,Bearish
"China's Financial Landscape: A Dance of Decline, Distrust, and Desperation",2023-08-17,Bearish
Bears are back bois,2023-08-17,Bearish
Too early to bring back this banger someone created during the first drop?,2023-08-17,Uncertain
Does this qualify for gain or loss porn?,2023-08-17,Uncertain
Going back to ant street bets,2023-08-17,Neutral
"What Are Your Moves Tomorrow, August 18, 2023",2023-08-17,Neutral
Let’s talk Hawaiian 🌺 (HE),2023-08-17,Neutral
$15.5k QQQ YOLO,2023-08-17,Neutral
Meanwhile at the USDT: Janet Yellen explains her 'magic mushroom' experience in China,2023-08-17,Neutral
Looking for resources to learn more about option.,2023-08-17,Neutral
I was a little bear-curious,2023-08-17,Neutral
"Michael Burry’s bet against the S&P 500 is going to be painful,",2023-08-17,Bearish
"Ladies and Gentlemen, prepare for landing 🩸🔻⏬📉🩸🩸🩸",2023-08-17,Bearish
Bulls this week,2023-08-17,Bullish
Options question 🤔,2023-08-17,Neutral
🚀🔥 PANW - Big Profits Incoming $150 8/25 🔥🚀,2023-08-17,Bullish
TSLA 1 DTE puts - 🐻,2023-08-17,Uncertain
How far can solar drop?,2023-08-17,Uncertain
In b4 bank run re-run,2023-08-17,Uncertain
I Hate what the market has turned into but KVUE/JNJ is a lil wild,2023-08-17,Neutral
(Update) I need a new hobby,2023-08-17,Neutral
401(k) Millionaires Stage a Comeback With Another Quarter of Gains,2023-08-17,Bullish
Japan is about to exit its almost decade long -ve short term rates.,2023-08-17,Stable
"US Steel (X) is gonna go up because of ""fundamentals"" whatever that is",2023-08-17,Speculative
Daytrading +430k,2023-08-17,Bullish
"10-year Treasury yield briefly rose above 4.31%, the most since the 2007-2008 global financial crisis, and the 30-year rate at 12 years high",2023-08-17,Stable
$GS forming a giant wedge pattern over the last 3 years.,2023-08-17,Neutral
"According to Fidelity, the average 401(k) balance has risen by 39% over the past ten years",2023-08-17,Stable
Why is AMC still gaining if the arbitrage is confirmed? It should be meeting the price of APE correct?,2023-08-17,Uncertain
Down 200k mtd thanks to $se and $mara,2023-08-17,Bearish
China Told State Banks to Escalate Yuan Intervention,2023-08-17,Neutral
Do you think shorting on China (like YANG) is a good idea now that China's economy is collapsing?,2023-08-17,Speculative
Burry has one play,2023-08-17,Neutral
PacWest going down?,2023-08-17,Bearish
$HE FEARS ARE GROSSLY EXEGERATED.,2023-08-17,Neutral
$TLRY 10K Yolo update… Thinking about doubling down.,2023-08-17,Speculative
"Fist time posting here, did I do this whole “trading” thing right?",2023-08-17,Neutral
Easy Short for a possible 500% gain by next month,2023-08-17,Speculative
Jim Cramer sent me into bankruptcy.,2023-08-17,Neutral
US Philadelphia Fed Index is +12 vs. -10 Expectations for August...,2023-08-17,Bullish
VFS valuation is absurd,2023-08-17,Speculative
BTIG warns S&P 500 may drop to 4200 over coming weeks By Investing.com,2023-08-17,Bearish
The world shed 3.5 million millionaires in 2022 as market losses drained wealth at the top,2023-08-17,Bearish
Looks like someone's Liquidity is worsening. 😂,2023-08-17,Neutral
"How to make money in a bear market, with a good risk management?",2023-08-17,Neutral
"30y US Treasury yield rises to 4.42%, highest since 2011. Risk Off mode on?",2023-08-17,Stable
"Daily Discussion Thread for August 17, 2023",2023-08-17,Neutral
One more -ve GDP print and the Dutch will be in Recession. Adyen a popular payment solution used by major US companies is down -25% today.,2023-08-17,Bearish
Sprinklr (CXM) vs Sprout Social (SPT),2023-08-17,Neutral
IonQ Says Reaching #AQ 64 will be a ChatGPT Moment for Quantum Computing,2023-08-17,Neutral
Larry Summers sees 10yr yields averaging 4.75%. Yields will go even more higher...!!!,2023-08-17,Bullish
Insurance Co value correlation w/ weather maps,2023-08-16,Neutral
Apple has ALWAYS been the winner,2023-08-16,Neutral
"Is it ""not good"" that CEO of $FOUR Shift4 payments seems to be obsessed with flying?",2023-08-16,Uncertain
Carvana Inventory of Cars - Mark Down on Assets,2023-08-16,Neutral
Goldman Sachs Blames Zero-Day Options for Fueling S&P 500 Selloff,2023-08-16,Neutral
WE DROPPING EVEN HARDER HERE 💋🥦💋,2023-08-16,Bearish
Some thoughts on Hawaiian electric,2023-08-16,Neutral
Puts on Burlington,2023-08-16,Uncertain
Why do we keep doing this?,2023-08-16,Uncertain
Ranked: Forbes reveals its next 10 billion-dollar startups,2023-08-16,Neutral
After making $1.71 on a single trade:,2023-08-16,Bullish
August is the best time to Yolo,2023-08-16,Speculative
$2.08 million Telus YOLO. Canadian telecoms love to play monopoly,2023-08-16,Neutral
$400k in TQQQ locked and loaded 🫡 🐂📈,2023-08-16,Bullish
Easy come easy go,2023-08-16,Neutral
U.S. National Debt Clock : Real Time,2023-08-16,Neutral
Atlanta Fed projects nearly 6% GDP growth in third quarter,2023-08-16,Bullish
S&P 500 Upward Trend Line Crossed Down Yesterday. Downward Trend has been Established.,2023-08-16,Bearish
Where do yall get all your capital?,2023-08-16,Neutral
"Surely this is euphoria for NVDA is not a bubble right, right?",2023-08-16,Neutral
"My avg price is #7.77 🚀 3,800 PTON shares",2023-08-16,Neutral
Let's milk the big short!!,2023-08-16,Speculative
How should one figure out position sizes on hedges?,2023-08-16,Neutral
Irish Bank causes the infinite money glitch.,2023-08-16,Uncertain
I Cant believe I actually made money on AMD,2023-08-16,Bullish
Red pill and blue pill. Which one do you choose?,2023-08-16,Neutral
What is this pattern at the end called?,2023-08-16,Neutral
"What Are Your Moves Tomorrow, August 17, 2023",2023-08-16,Neutral
I need a new hobby,2023-08-16,Neutral
$SE Buying the earnings dump,2023-08-16,Bullish
Not sure if I should hop off NVDA now or wait for the earnings report.,2023-08-16,Uncertain
I hope this plays out Spy 444 8/18 9k yolo,2023-08-16,Speculative
I’m back with $40k of Nvidia calls,2023-08-16,Bullish
Jim Cramer says he doesn't want to own PayPal,2023-08-16,Neutral
SPY 0DTE 32K Gain,2023-08-16,Bullish
I LOVE losing $4k in 3 months over blue chip stocks!! Might as well have bought penny stocks. Thank you U.S. Economy!,2023-08-16,Bearish
"Fed officials see ‘upside risks’ to inflation possibly leading to more rate hikes, minutes show",2023-08-16,Uncertain
"I was taught to Buy, Hold, and DCA monthly...",2023-08-16,Stable
My Warren Buffett YOLO can’t go Tits Up right? Right? $X,2023-08-16,Speculative
Jump ship Bulls.,2023-08-16,Speculative
Fuck NVIDIA Stock It’s A Huge Piece Of Shit I Wouldn’t Buy If It Was A Dollar,2023-08-16,Bearish
Are any of you actually educated?,2023-08-16,Neutral
ArcelorMittal weighs possible bid for US Steel,2023-08-16,Neutral
Amazon Is Imposing Fee on Sellers Who Ship Products Themselves,2023-08-16,Neutral
"While Home Depot’s sales experience a decline, Warren Buffett is making significant investments in the housing sector",2023-08-16,Neutral
Are targeted ads based on my trading history?,2023-08-16,Neutral
"No, Michael Burry Didn't Risk 93% of His Portfolio on Put Options",2023-08-16,Neutral
Chinese govt asking investment funds to avoid selling onshore chinese stocks. 🍿,2023-08-16,Neutral
How is this possible and why aren't yields moving up?,2023-08-16,Uncertain
Rtx Ready to Fly,2023-08-16,Bullish
Best way to hedge company unvested tech shares?,2023-08-16,Neutral
Why is US Steel (X) shorted so much?,2023-08-16,Uncertain
Pretty sure ill make 100k eod today with these many options on $se,2023-08-16,Speculative
How the fuck is SPY up 17% this year?,2023-08-16,Speculative
AMC Entertainment to effect 10:1 reverse split on Aug. 24,2023-08-16,Neutral
True story,2023-08-16,Neutral
Homeowners are tapping into their home equity to get cash,2023-08-16,Neutral
"Guys it’s obvious now, don’t miss out X formation.",2023-08-16,Speculative
"Citadel Acquires Yellow Debt Owned by Apollo, Other Lenders",2023-08-16,Stable
"Daily Discussion Thread for August 16, 2023",2023-08-16,Neutral
Apple's new iPhone 15 sees start of production in India,2023-08-16,Neutral
What is Sea Limited (SE)'s moat?,2023-08-16,Neutral
I have good and bad news for you guys who trade SPX.,2023-08-16,Neutral
German sandal maker Birkenstock heads to US stock market – DW,2023-08-16,Neutral
Red is my favorite color,2023-08-16,Neutral
Inflation and Stock Prices,2023-08-16,Neutral
JPMorgan hikes EM default forecast as Country Garden drives China contagion fears,2023-08-16,Uncertain
What influences when I should buy?,2023-08-16,Neutral
Retail Blood🩸in the Streets Tomorrow,2023-08-16,Bearish
Morningstar Lowers Curaleaf Price from $20 US to $17 US,2023-08-16,Bearish
The 3 Most Undervalued Gaming Stocks to Buy Now: August 2023,2023-08-15,Neutral
Intel to Call Off $5.4 Billion Tower Deal Without Chinese Approval,2023-08-15,Uncertain
Some regarded analysis of Madison Square Garden Sports Corp (MSGS),2023-08-15,Neutral
I still think market will make new ATH,2023-08-15,Bullish
Yellen gets high with rates and mushrooms,2023-08-15,Speculative
IT ain't over till McDonald's fire me (I deadass work there),2023-08-15,Neutral
"NAAIM hit technical support, stocks go up only from here",2023-08-15,Bullish
Apple to start paying $500 million in ‘BatteryGate’ lawsuit payments,2023-08-15,Stable
India makes first crude oil payment to UAE in Indian rupees,2023-08-15,Stable
$200k in SQQQ locked and loaded 🫡 🌈 🐻,2023-08-15,Bullish
Eat Shit Netflix You Over Priced Unoriginal Fuck Heads,2023-08-15,Oversold
Are we currently or about to exit a massive bull trap similar to the one that happened mid-DotCom bubble? (deets in text below),2023-08-15,Uncertain
Why do some people here think Burry sold his QQQ/SPY puts already?,2023-08-15,Neutral
Stocks sink as China woes spark global sell-off,2023-08-15,Bearish
US Steel Corporation YOLO,2023-08-15,Speculative
"What Are Your Moves Tomorrow, August 16, 2023",2023-08-15,Neutral
$AMD 73k YOLO update still fucked,2023-08-15,Oversold
US Banks are grossly over leveraged. The coming downgrades are warranted.,2023-08-15,Bearish
Tesla Puts Please Crash Thanks,2023-08-15,Speculative
A Tale of Two REITS and one Bad Boy named Portnoy (not that one) $DHC,2023-08-15,Neutral
Atlanta Fed GDP now is at 5% while inflation is projected to be 3.6% YoY min by Sept. Where tf are these Bond Vigilantes?,2023-08-15,Neutral
I’m hurting guys $PYPL,2023-08-15,Bearish
Regional bank crash 3.0 incoming,2023-08-15,Bearish
"HELP! My SPY option expired 11 DOLLARS in the money, and my broker exercised it overnight! T_T",2023-08-15,Uncertain
"NVDA $27,000 PUTS",2023-08-15,Speculative
It keeps getting worse,2023-08-15,Bearish
Michael Burry’s Wet Dream: The Crash of 2008,2023-08-15,Neutral
"Fitch warns it may be forced to downgrade dozens of banks, including JPMorgan Chase",2023-08-15,Neutral
Petrobras is undervalued.,2023-08-15,Speculative
"I followed the “ if it’s good to screenshot, it’s good to sell” rule",2023-08-15,Neutral
New credit card and auto loan delinquencies have now surpassed pre-Covid levels.,2023-08-15,Stable
"$GRINDR Reports Q2 Income, 32% revenue growth; 2023 Revenue Outlook Raised; +8% today",2023-08-15,Bullish
APLS Bounce back oppertunity,2023-08-15,Bullish
LYFT Price Action,2023-08-15,Neutral
"Why is TLT still falling despite disinflation, looming recession fears and China deflation (exporting it to RoW).",2023-08-15,Uncertain
Retail earnings this week could say a lot about the state of America's economy,2023-08-15,Neutral
Zapata AI and IonQ Collaborate to Advance Generative AI Research,2023-08-15,Neutral
Inverse Burry?,2023-08-15,Speculative
Your Next Amazon Order Might Be Delivered Without A Box,2023-08-15,Neutral
NVDA execs like the stock,2023-08-15,Neutral
Indi Semiconductor on verge of profitability.,2023-08-15,Bullish
"Fitch warns it may be forced to downgrade dozens of banks, including JPMorgan Chase",2023-08-15,Uncertain
"Daily Discussion Thread for August 15, 2023",2023-08-15,Neutral
China central bank unexpectedly cuts rates to support sputtering economy,2023-08-15,Neutral
"""The central bank is a scam. It is a mechanism by which politicans cheat people through the inflationary tax."" J. Milei",2023-08-15,Bearish
This is what a friendshoring era looks like in contrast to free-market capitalism in FX markets.,2023-08-15,Neutral
My thoughts about Nvidia,2023-08-15,Neutral
Yuan is getting killed today. This reminds me of Yen Doomloop from last year when BOJ had to sell US bonds.,2023-08-15,Bearish
"Felt bearish, might delete later",2023-08-15,Bearish
The Chad Powell vs the Virgin Yellen,2023-08-15,Uncertain
Which tech stocks are on the receiving end of government spending?,2023-08-15,Neutral
"Tesla Rolls Out Lower Spec Models S, X That Are $10,000 Cheaper",2023-08-15,Neutral
What's with all the hate on Robinhood?,2023-08-14,Neutral
"Streaming TV costs now higher than cable, as 'crash' finally hits",2023-08-14,Neutral
Do you believe in Nvidia in the long term?,2023-08-14,Neutral
NVDA short - who's with me?,2023-08-14,Bearish
China deflation. How can a regard profit?,2023-08-14,Uncertain
"Burry, famous for 'Big Short,' bought bearish options against S&P, Nasdaq 100 By Reuters",2023-08-14,Bearish
Wallstreet's DWAC DeSPAC Triple Stacker Heart Attack - Extra Greasy,2023-08-14,Speculative
So bad at options I got removed and reapplied,2023-08-14,Uncertain
NVDA Bull trap,2023-08-14,Speculative
Anyone interested in the $X purchase should watch this,2023-08-14,Neutral
NVDA DD/hopium/ramblings/thoughts/prayers/synopsis/bedtime reading,2023-08-14,Uncertain
Yellen says the U.S. economy is on track for stable growth thanks to Inflation Reduction Act boost,2023-08-14,Stable
I flipped a coin and it came out telling me to go fuck myself,2023-08-14,Uncertain
A feud is heating up between Arizona workers and the world's leading chipmaker after the company said the US didn't have the skills to build,2023-08-14,Uncertain
Saudi Arabia and UAE race to buy Nvidia chips to power AI ambitions,2023-08-14,Neutral
"What Are Your Moves Tomorrow, August 15, 2023",2023-08-14,Neutral
QQQ 0DTE 370C,2023-08-14,Neutral
25k yolo see y’all in a few weeks,2023-08-14,Speculative
2 Week Update - (CLOV) Clover Health up 30%…and just beginning,2023-08-14,Bullish
All-Cash Public Offer for U.S. Steel (X) Shares,2023-08-14,Neutral
Goldman Sachs expects core inflation to fall enough for the Federal Reserve to start cutting rates in Q2 2024... This is a joke right?,2023-08-14,Neutral
AMD a grossly under valued company,2023-08-14,Bullish
$SU Puts YOLO.. Not gonna lie i thought they were a solar company until reading my own post,2023-08-14,Neutral
Jay Powell is an Economic and Political Genius,2023-08-14,Neutral
Sarepta's DNA Goldmine: SRPT 🧬,2023-08-14,Neutral
TradingView dev's are in this sub for sure,2023-08-14,Neutral
The Return of the Regard!!!,2023-08-14,Bullish
WSB Twitter account suspended 5 minutes after posting about Elon Musk acquiring US Steel ($X),2023-08-14,Uncertain
Just like 2006-07.🤣,2023-08-14,Neutral
Story Of A Degen,2023-08-14,Uncertain
"One of us, one of us...",2023-08-14,Neutral
AMD P/E ratio,2023-08-14,Neutral
TSLA chart showing bull v ber light saber battle,2023-08-14,Neutral
Bloomberg: Struggling Marijuana Industry Eyes Ohio for a Much-Needed Boost,2023-08-14,Neutral
"Have first adopters/ buyers cooled enough to call Tesla a ""mature product"".",2023-08-14,Neutral
"Elon Musk literally just flew into Cleveland this morning, where Cleveland-Cliffs is headquartered.",2023-08-14,Neutral
I just went outside and saw a lot of trucks. The economy is BOOMiNG.,2023-08-14,Stable
"Yolo, against the trend or with the trend?",2023-08-14,Speculative
Thoughts on Briacell Therapeutics?,2023-08-14,Neutral
This regard was right !,2023-08-14,Neutral
"45k WeWork YOLO, see ya at 10 bucks.",2023-08-14,Speculative
$KRT LETS GO,2023-08-14,Bullish
Come on Bears,2023-08-14,Bearish
Nikola ($NKLA) Drops 10% After Battery Fires Spur Recall and Sales Halt,2023-08-14,Bearish
QQQ 0DTE 367C,2023-08-14,Neutral
Hawaiian Electric Industries Inc. ($HE) Drops 40% as Lawyers Probe Cause of Deadly Maui Wildfires,2023-08-14,Bearish
PayPal CEO Announce,2023-08-14,Neutral
Do you think Nvidia will beat Q2 earning expectations?,2023-08-14,Speculative
"Companies That Offer Unlimited Vacations Will Outperform S&P 500, Investors Say",2023-08-14,Speculative
Visualizing the new era,2023-08-14,Neutral
"Nvidia NVDA, close to a 16% off sale, all the way down to 39x sales :/",2023-08-14,Bearish
